{
  "schema": "web3-qualification/v1/receipt",
  "campaign_id": "SYNTHETIC_FIXTURE_NOT_ACTUAL_BOT",
  "plan_sha256": "d47c90e91671bf437982d67d5a9478608039f298364bfb4a400ab848cd4541e1",
  "stage_id": "observation",
  "adapter": "observation_window.v1",
  "binding": {
    "repo_revision": "0000000000000000000000000000000000000000",
    "config_sha256": "efab140a8c2922093d65b5ef02abaddf32ecd8d502f4659dce99e5bd3e8ec1dc",
    "input_manifest_sha256": "896efa1d330c9123899d36dca40b125cf5af97f83890651a179863f5cc7fd84c",
    "environment_sha256": "13440a4654769788a562b44da2e7b03b5e58fb25cab580a3bb220c242669e66d",
    "network": {
      "family": "offline_fixture",
      "network_id": "fixture:1",
      "genesis_hash": "synthetic"
    },
    "anchor": {
      "height": "0",
      "hash": "synthetic",
      "finality": "fixture"
    },
    "provider": {
      "id": "synthetic",
      "version": "1"
    },
    "model": {
      "id": "none",
      "revision": "none"
    },
    "toolchain": {
      "fixture_generator": "build_specs.py/v1"
    }
  },
  "producer": {
    "id": "synthetic-fixture-generator",
    "version": "1",
    "binary_sha256": "10820788d3c161281804469e0c59a013669284af2906b0e564ba182ee9eb42f5",
    "kind": "machine_runner"
  },
  "started_at": "2026-10-03T16:50:00Z",
  "completed_at": "2026-10-03T16:59:30Z",
  "process": {
    "state": "EXITED",
    "exit_code": 0
  },
  "artifacts": [
    {
      "role": "observations",
      "path": "observations.jsonl",
      "bytes": 622,
      "sha256": "dc5571fa3e4c2e9a46e7408a7ebb51cd1d156bfaaf96260f4a3634c272a0eb70"
    }
  ]
}
